dependency, id_estado_obra, num, municipio, categoria, obra, empresa, numero_contrato, monto_contrato, inicio_obra_segun_contrato, termino_obra_segun_contrato, fecha_pago_anticipo, monto_anticipo, fecha_convenio_ampliacion_obra, convenio_ampliacion_economico, monto_contrato_final, total_pagado, anticipo_pendiente_amortizar, avance_financiero, avance_fisico_verificado_por_la_contraloria, entregada_al_beneficiario, fecha_de_verificacion_contraloria, estatus_verificado_por_la_contraloria,,,,,
4,0,1,Dr. Arroyo,Construcción,"Construcción de 8,275 m.l. de línea de conducción de agua potable con tubería de PVC RD-18 de 8"" de diámetro norma AWWA C-900 vigente y 50 m.l. de tubería de acero ced.40 de 8”Ø.|","Equipos Construcciones Y Servicios, S.A. de C.V.",SADM-APARURAL-02-2018-C                          ,"$9,715,730.85",18-May-18,3-Jan-19,17-May-18,"$2,914,719.26",25-May-18,$0.00,"$9,715,730.85","$9,525,678.30","$74,723.48",98%,100%,No Entregada,17-Jan-19,Obra Terminada 
4,0,2,"
Dr. Arroyo,  Linares,  Hualahuises y Montemorelos",Construcción,a) Construcción de 3 casetas para equipo de cloración.    b) Construcción de caseta para equipo de cloración.   c) Construcción de 2 casetas para equipo de cloración.  d) Construcción de caseta para equipo de cloración.,"Pavimentos Conservación Y Microsuperficie, S.A. de C.V.",SADM-AGUA LIMPIA-01-2018-I    ,"$751,912.38",9-Jul-18,5-Dec-18,7-Sep-18,"$225,573.71",Sin convenio,$0.00,"$751,912.38","$522,971.47",$0.02,70%,100%,No Entregada,21-Jan-19,Obra Terminada
4,0,3,Escobedo,Construcción,"Construcción de red de agua potable con 950 metros con una tubería PVC-C900 RD-25 de 4"" Ø, 977 metros con una tubería PVC-C900 RD-25 de 6"" Ø, 15 metros con una tubería PVC-C900 RD-25 de 8"" Ø y 168 tomas domiciliarias.","Construcciones Firmes Mexicanas, S.A. de C.V.",SADM-APAUR-14-2018-I                  ,"$3,121,232.58",4-Sep-18,23-Dec-18,3-Sep-18,"$936,369.77",12-Sep-18,$0.00,"$3,121,232.58","$3,112,574.27",$0.01,100%,100%,No Entregada,15-Jan-19,Obra Terminada
4,0,4,Escobedo,Construcción,"Introducción de red de drenaje sanitario con 1,485 metros de tubería de 0.20 m. (8"") Ø y 272 metros de tubería de 0.25 m (10""), ambas de policloruro de vinilo (P.V.C.) de pared solida serie 20, NMX-E-215/1-SCFI-2003 vigente y 136 descargas domiciliarias. ","Constructora Jomabe, S.A. de C.V.",SADM-APAUR-15-2018-I              ,"$3,094,539.33",6-Sep-18,25-Dec-18,5-Sep-18,"$928,361.80",14-Sep-18,$0.00,"$3,094,539.33","$2,536,140.15","$232,457.66",82%,100%,No Entregada,7-Mar-19,Obra Terminada
4,0,5,Galeana,Construcción,"Construcción de Red de Agua Potable con 1380 mts. Con una tubería PVC-C900 RD-25 DE 6"" Ø, 30 mts. De Tubería de Acero al Carbón de 6"" Ø X ced. 40 esp. y una toma domiciliaria.","Infraestructura Y Construcciones García, S.A. de C.V.",SADM-RP-05-2018-I,"$2,409,250.38",1-Oct-18,29-Nov-18,Sin Información,"$722,775.11",Sin convenio,$0.00,"$2,409,250.38","$1,825,939.62","$249,975.41",76%,100%,Entregada  ,18-Jan-19,Obra Terminada
4,0,6,García,Construcción,"Introducción de red de agua potable de 1,345 m.l. de tubería de PVC RD-25 de 4""Ø norma AWWA C-900 vigente, 685 m.l. de tubería de PVC RD-25 de 6""Ø norma AWWA C-900 vigente y 184 tomas domiciliaras. ","Construcciones Y Servicios Montemayor, S.A.  de C.V.",SADM-APAUR-04-2018-I                            ,"$3,299,884.67",18-May-18,4-Dec-18,17-May-18,"$989,965.40",25-May-18,$0.00,"$3,299,884.67","$1,790,662.58","$645,366.01",54%,100%,Entregado,11-Feb-19,Obra Terminada
4,0,7,García,Construcción,"Construcción de red de agua potable con 1,185 metros de tubería PVC-C900 RD-25 de 4"" Ø y 98 tomas domiciliarias.","Caminos Construcción Y Puentes Almaguer Garza, S.A. de C.V.",SADM-APAUR-13-2018-I                                      ,"$1,767,623.34",4-Sep-18,23-Dec-18,3-Sep-18,"$530,287.00",12-Sep-18,$0.00,"$1,767,623.34","$1,690,140.76",$0.01,96%,100%,Entregado,11-Feb-19,Obra Terminada
4,0,8,García,Construcción,"a) Introducción de red de agua potable de 172 m.l. de tubería de PVC RD-25 de 6""Ø norma AWWA C-900 vigente y 11 tomas domiciliaras.   
b) Introducción de red de drenaje sanitario con 172 m.l. de tubería de 0.20 m. (8"") Ø de policloruro de vinilo (P.V.C.) de pared sólida serie 20, NMX-E-215/1-SCFI-2003 vigente y 11 descargas domiciliarias. (SADM)
","Kelvin Construcciones, S.A.  de C.V.",SADM-APAUR-05-2018-I                                      ,"$790,409.78",13-Jun-18,31-Aug-18,12-Jun-18,"$237,122.94",23-Aug-18,$0.00,"$790,409.78","$724,669.96",$0.01,92%,100%,No Entregada,26-Sep-18,Obra Terminada
4,0,9,Juárez,Construcción,"Construcción de 479 metros de línea de alimentador tanque La Paz I, con tubería de 18”Ø, de policloruro de vinilo (PVC) C-900 AWWA RD-25  y bayoneta de acero  de 457mm (18"") Ø, calidad de placa 5 lb, con longitud de 42 metros, con Norma Oficial Mexicana NOM-001-CONAGUA-2011 y NMX-C-012-ONNCCE-2007.","Constructora Alvizo Martínez Y Asociado, S.A. de C.V.",SADM-APAUR-10-2018-I               ,"$4,048,419.57",2-Aug-18,20-Dec-18,1-Aug-18,"$1,214,525.87",10-Aug-18,$0.00,"$4,048,419.57","$4,042,107.56",$0.02,100%,100%,No Entregada,14-Jan-19,Obra Terminada
4,0,10,"Melchor Ocampo
",Rehabilitación,Reubicación de la planta paquete de tratamiento de agua residual del municipio de Gral. Treviño al municipio de Melchor Ocampo y construcción de la base de concreto reforzado para su colocación. (SADM),"Constructora QARQ, S.A.  de C.V.",SADM-RP-03-2018-I                               ,"$805,623.50",16-Jul-18,14-Aug-18,7-Aug-18,"$241,687.05",Sin convenio,$0.00,"$805,623.50","$778,538.65",$0.01,97%,100%,No Entregada,27-Sep-18,Obra Terminada
4,0,11,Montemorelos,Construcción,"Construcción de colector de drenaje sanitario con 642.43 metros de tubería de policloruro de vinilo (P.V.C.) pared sólida serie 20  según norma NMX-E-215/1-SCFI-2003, de 12"" Ø y 6 descargas domiciliarias.","Foja Ingenieros Constructores, S.A.  de C.V.",SADM-RP-02-2018-I              ,"$3,080,612.94",18-Jun-18,16-Aug-18,4-Oct-18,"$924,183.88",Sin convenio,$0.00,"$3,080,612.94","$924,183.88","$924,183.88",30%,100%,No Entregada,5-Mar-19,Obra Terminada
4,0,12,Monterrey,Construcción,"a) Introducción de red de drenaje sanitario con 200 m.l. de tubería de 0.20 m. (8"") Ø de policloruro de vinilo (P.V.C.) de pared sólida serie 20, NMX-E-215/1-SCFI-2003 vigente y 27 descargas domiciliarias.
b) Introducción de red de agua potable de 110 m.l. de tubería de acero ced. 40 de 4""Ø y 13 tomas domiciliaras.","Urbanización Y Edificación Icmac, S.A.  de C.V.",SADM-APAUR-06-2018-I                                ,"$986,490.81",18-May-18,13-Jan-19,17-May-18,"$295,947.24",25-May-18,$0.00,"$986,490.81","$984,423.19",$0.01,100%,100%,No Entregada,15-Jan-19,Obra Terminada
4,0,13,Monterrey, Construcción  ,"a) Introducción de red de drenaje sanitario con 56 m.l. de tubería de 0.20 m. (8"") Ø de policloruro de vinilo (P.V.C.) de pared sólida serie 20, NMX-E-215/1-SCFI-2003 vigente y 2 descargas domiciliarias.       b) Introducción de red de agua potable de 63 m.l. de tubería de PVC RD-25 de 4""Ø norma AWWA C-900 vigente y 4 tomas domiciliaras. ","M T Excava Y Construye, S.A.  de C.V.",SADM-APAUR-07-2018-I                                ,"$283,657.15",13-Jun-18,12-Aug-18,12-Jun-18,"$85,097.15",21-Jun-18,$0.00,"$283,657.15","$281,349.10",$8.99,99%,100%,No Entregada,25-Sep-18,Obra Terminada
4,0,14,Santiago,Construcción,Construcción de Cárcamo de Bombeo San Juan Marroquín,"Eleba Construcciones, S.A. de C.V.",SADM-APAUR-08-2018-C,"$3,687,323.17",31-Jul-18,18-Dec-18,30-Jul-18,"$1,106,196.95",8-Aug-18,$0.00,"$3,687,323.17","$2,026,707.51","$707,534.97",45%,100%,No Entregada,7-Mar-19,Obra Terminada 
4,0,15,Santiago,Construcción,"A) Construcción de Red de Agua Potable con 312 mts. Con tubería PVC-C900 RD-25 de 4""Diam. Y 33 Tomas Domiciliarias. B) Construcción de Red de Agua Potable con 194 mts.  Con una tubería PVC-C900 RD-25 de 6""DIAM., 184 MTS. Con tubería de PVC-C900 RD-25 DE 4"" DIAM., 21 Tomas Domiciliarias y 27 mts. de tubería de acero al  carbón de 6"" diam. x cédula 40.          C) Introducción de 55 mts. de Red de Drenaje Sanitario en Diam. de 0.20m. (8""), con tubería de PVC. pared solida serie 20, incl. 17 descargas Domiciliarias.","Insumo Construcciones Del Golfo, S.A. de C.V.",SADM-APAUR-21-2018-I   ,"$2,160,729.46",6-Sep-18,15-Dec-18,5-Sep-18,"$648,218.84",14-Sep-18,$0.00,"$2,160,729.46","$1,914,825.71",$0.09,89%,100%,No Entregada,7-Feb-19,Obra Terminada 
4,1,1,Dr. Arroyo,Rehabilitación,"Rehabilitación del acueducto El Desierto con 2,311 mts. de tubería de hierro dúctil en diámetro nominal de 350 mm clase C30, 55 mts. de tubería de acero de 3/8"" de espesor de 14"" de diámetro. ","ELEBA CONSTRUCCIONES, S.A. DE C.V.",SADM-DEV-DER-05-2018-C,"$11,166,572.61",14-Jan-19,28-Apr-19,30-Jan-19,"$3,349,971.78",Sin convenio,$0.00,"$11,166,572.61","$3,349,971.78","$3,349,971.78",30%,90%,No Entregada,2-Apr-19,"En esta obra se tiene el 100% de los trabajos de excavación y se tienen instalados 1,100 mts de la tubería de acero de 14""Ø, falta de llegar el resto de la tubería."
4,1,2,Dr. Arroyo,Rehabilitación,"Rehabilitación del acueducto El Desierto con 2,367 mts. de tubería de hierro dúctil en diámetro nominal de 350 mm clase C30. ","CONAMSA URBANIZADORA, S.A. DE C.V.",SADM-DEV-DER-03-2018-C,"$10,882,093.80",14-Jan-19,28-Apr-19,30-Jan-19,"$3,264,628.14",Sin convenio,$0.00,"$10,882,093.80","$3,264,628.14","$3,264,628.14",30%,80%,No Entregada,2-Apr-19,"Actualmente se tiene terminada  la longitud total de la excavación Y 1,100 mts de tubería de tubería instalada, ya se efectuaron las conexiones para realizar la prueba hidrostática de este tramo de línea."
4,1,3,Dr. Arroyo,Rehabilitación,"Rehabilitación del acueducto El Desierto con 2,367 mts. de tubería de hierro dúctil en diámetro nominal de 350 mm clase C30. ","EQUIPOS CONSTRUCCIONES Y SERVICIOS, S.A. de C.V.",SADM-DEV-DER-04-2018-C,"$9,780,610.88",14-Jan-19,28-Apr-19,30-Jan-19,"$2,934,183.26",Sin convenio,$0.00,"$9,780,610.88","$2,934,183.26","$2,934,183.26",30%,40%,No Entregada,2-Apr-19,"Los trabajos de excavación, se encuentran totalmente terminados y se está en espera de recibir la tubería para iniciar su instalación."
4,1,4,Dr. Arroyo,Construcción,"Introducción de línea de conducción de agua potable del pozo Parque Tanquecillos a estación de bombeo Pozo El Desierto con 842  metros de tubería de policloruro de vinilo (PVC) hidráulico con norma AWWA-C900 de 12"" Ø en RD-18 y 58 metros de tubería de acero al carbón de 12” Ø x 3/8” esp.",Análisis de Sitio y Gestión Urbana S.A. de C.V.,SADM-DEV-DER-02-2018-C,"$3,539,546.71",17-Dec-18,15-Apr-19,10-Jan-19,"$1,061,864.01",Sin convenio,$0.00,"$3,539,546.71","$1,061,864.01","$1,061,864.01",30%,40%,No Entregada,2-Apr-19,"Se iniciaron los Trabajos, actualmente se tiene la excavación e instalación de 280 mts tubo de 12"" Ø acero al carbón, el resto de los trabajos se están  ejecutando en otra ubicación (No incluida en el contrato) por la falta de los documentos oficiales que certifiquen la donación del pozo y equipo de bombeo."
4,1,5,Mina,Construcción,"Instalación, montaje y colocación de  17 km. de redes existentes de distribución y acometidas eléctricas en media tensión de 34.5 KV en operación, infraestructura perteneciente al Sistema Mina. ","ROJO CONSTRUCCIONES E INGENIERÍA, S.A. DE C.V.",SADM-RP-07-2018-C,"$15,048,336.83",17-Dec-18,14-Jun-19,En Trámite,Sin Información,Sin convenio,$0.00,"$15,048,336.83",$0.00,$0.00,0%,15%,No Entregada,9-Apr-19,"Se tiene instalado 38 pzas de postes de concreto, 6 retenidas instalados del pozo 7 al 16 y se realizó el retiro de 1710 ml de línea eléctrica existente. No hubo mucho avance ni se encontró gente trabajando porque no ha llegado el suministro del cable."
4,2,1,Apodaca,Construcción,"Instalación de 1,927 ml de tubería de 16"" de diámetro, colector Cerritos de Agua Fría-Valle Azul. (SADM)","Desarrollos Industriales Mapex, S.A. DE C.V.",SADM-APAUR-17-2018-C                                      ,"$6,298,875.43",4-Sep-18,13-Dec-18,3-Sep-18,"$1,889,662.63",12-Sep-18,$0.00,"$6,298,875.43","$3,987,586.23","$987,069.97",63%,75%,No Entregada,8-Apr-19,"Se lleva alrededor de 1,458.30 ml. de tubería suministrada e instalada, se evocan en el relleno de las mismas, 25 pozos de visitas suministrados e instalados y 4 pozos más en proceso, carece de señales viales, siendo que en el catálogo del contratista se cotizo $121,062.64 del concepto."
4,2,2,Apodaca,Construcción,"Construcción de 448 metros de línea de alimentador tanque Santa Rosa I, con tubería de PVC C-900 de 18""Ø Norma AWWA C-900 vigente.","RGC Ingeniería, S.A.  de C.V.",SADM-APAUR-09-2018-I                                      ,"$3,147,330.03",31-Jul-18,18-Dec-18,30-Jul-18,"$944,199.01",8-Aug-18,$0.00,"$3,147,330.03","$944,199.02","$944,199.02",30%,35%,No Entregada,5-Apr-19,"Se tiene hasta el momento de la visita 184 metros de tubería instalada, 172 metros de relleno de tubería y alrededor de 367.50 metros de excavación del trazo de tubería, teniendo hasta el momento de la visita un 35% de Avance Físico."
4,2,3,Apodaca,Construcción,"Construcción de línea de drenaje sanitario con 1,320 m.l. de tubería de policloruro de vinilo (P.V.C.) pared sólida serie 20 según norma NMX-E-215/1-SCFI-2003 de 12”Ø. ","BUFETTE DE OBRAS SERVICIOS Y SUMINISTROS, S.A. DE C.V.",SADM-APAUR-24-2018-C,"$2,991,241.40",14-Jan-19,29-Mar-19,En Trámite,Sin Información,Sin convenio,$0.00,"$2,991,241.40",$0.00,$0.00,0%,61%,No Entregada,5-Apr-19,"Se encontró personal trabajando en compactación de base cementada y sub base, actualmente se tienen 900 ml de tubería instalada y la ejecución de 6 pozos. Se observó que el dado de concreto para protección de tubería se realiza a tiro libre sin cimbra."
4,2,4,Dr. Arroyo,Perforación,"Reposición de pozo colapsado en sistema de pozo El Desierto, incluye exploración, perforación, aforo de pozo profundo, equipamiento de pozo con capacidad de 60 LPS, líneas de conducción de agua potable y entrada al tanque.","Consorcio Industrializado Del Bajo Bravo, S.A. de C.V.",SADM-APAUR-18-2018-C                  ,"$12,768,377.42",20-Aug-18,27-Nov-18,19-Sep-18,"$3,830,513.23",Sin convenio,$0.00,"$12,768,377.42","$2,819,015.91","$3,388,074.49",22%,75%,No Entregada,2-Apr-19,"Se terminó con la perforación del pozo profundo con una profundidad de 370 mts, obteniendo el aforo requerido, por lo que se realizó el cambio de diámetros de Perforación, se tienen perforados 172 mts, faltando solo 28 mts. para finalizar con línea de operación de 24""Ø, se tiene una perforación de 30.0 mts. de ademe de 30""Ø."
4,2,5,Dr. Arroyo,Construcción,"Integración del sistema de pozos El Desierto mediante la construcción de tanque de almacenamiento de 300 M³ y cárcamo seco con 3 bombas de 40 LPS, para suministro en cabecera municipal y comunidades rurales.","Innovacero, S.A. de C.V.",SADM-APAUR-19-2018-C                ,"$10,246,072.08",20-Aug-18,27-Nov-18,5-Oct-18,"$3,073,821.62",Sin convenio,$0.00,"$10,246,072.08","$3,073,821.60","$3,073,821.60",30%,20%,No Entregada,2-Apr-19,Se está trabajando en la preparación de la cimbra para el colado de los muros del cárcamo.
4,2,6,Dr. Arroyo,Construcción,"Construcción de tanque superficial de concreto reforzado de 1,000 m³ (la calera) y construcción de 750 m.l. de línea de conducción de agua potable con tubería de PVC RD-18 de 8"" de diámetro norma AWWA C-900 vigente y  50 m.l. de tubería de acero ced.40 de 8”Ø. ","Construcciones Gv De Monterrey, S.A. de C.V.",SADM-APARURAL-01-2018-C                  ,"$8,990,143.50",23-May-18,9-Dec-18,22-May-18,"$2,697,043.05",28-May-18,$0.00,"$8,990,143.50","$4,321,984.32","$1,998,672.10",48%,75%,No Entregada,2-Apr-19,"Se aprecia un avance general aprox. del 75%,  se terminó el colado de muros, se está trabajando en la instalación de la cimbra para el colado de la losa del techo del tanque, la construcción de la Línea de llegada de agua potable, se encuentra totalmente  terminada, faltando solamente la línea de salida."
4,2,7,Escobedo,Rehabilitación,Reubicación de línea de bombeo de agua potable de 48” Ø de agua Santa Rosa II a tanque Nueva Castilla III tramo 2.,"Servicios Comerciales de Mexico, S.A. DE C.V.",SADM-RP-12-2018-AD,"$2,445,301.39",17-Dec-18,10-Jan-19,En Trámite,Sin Información,Sin convenio,$0.00,"$2,445,301.39",$0.00,$0.00,0%,30%,No Entregada,9-Apr-19,"Al realizar la inspección física de la obra, no se cuenta con programa y/o catálogo con el cual se pudiese saber las dimensiones de la obra, de las cuales se le insistió constantemente al personal de agua y drenaje la documentación pertinente, el Supervisor de la obra nos comenta que se tiene la tubería construida, faltando solamente la instalación de la misma."
4,2,8,Escobedo,Rehabilitación,"A) Reubicación de tubería de drenaje sanitario de 12"" Ø.     
 B) Reubicación de tubería de 6"" Ø de agua potable,  
C) Reubicación de tubería de 6"" Ø de agua potable.
","Constructora REVIU, S.A. DE C.V.",SADM-RP-11-2018-AD,"$2,371,963.79",17-Dec-18,10-Jan-19,En Trámite,Sin Información,Sin convenio,$0.00,"$2,371,963.79",$0.00,$0.00,0%,50%,No Entregada,9-Apr-19,"Al realizar la inspección física de la obra, no se cuenta con programa y/o catálogo con el cual se pudiese saber las dimensiones de la obra. De las cuales se le insistió constantemente al personal de agua y drenaje la documentación pertinente. Siendo que el Supervisor de la obra nos comenta que la obra ""A"" está terminada, y las obras ""B"" y ""C"" están en proceso."
4,2,9,Escobedo,Rehabilitación,"A) Reubicación de tubería de 18” Ø de agua potable alimentador Tanque Nueva Castilla III. 
B) Reubicación de tubería de 14” Ø de agua tratada alimentador de agua tratada PTAR Norte a Zona Industrial Carretera Laredo.
","Execución de México, S.A. DE C.V.",SADM-RP-13-2018-AD,"$1,398,677.55",17-Dec-18,10-Jan-19,En Trámite,Sin Información,Sin convenio,$0.00,"$1,398,677.55",$0.00,$0.00,0%,1%,No Entregada,9-Apr-19,"Al realizar la inspección física de la obra, no se cuenta con programa y/o catálogo con el cual se pudiese saber las dimensiones de la obra, de las cuales se le insistió constantemente al personal de agua y drenaje la documentación pertinente, el Supervisor de la obra nos comenta que solo se tiene el trazo de la obra."
4,2,10,Galeana,Ampliación ,"A) Ampliación de Red de Agua Potable con 535 mts. Con una tubería PVC-C900 RD-25 DE 4"" Ø, 30 mts. y una toma domiciliaria.  B) Ampliación de 423 mts. De Drenaje Sanitario en Diam. de 0.20 m (8"" Ø), Con una tubería PVC pared solida serie 20 según Norma NMX-E-215/1-CNCP, incluye una descarga domiciliaria.","Maquinaria Hdl y Servicios Inmobiliarios, S de RL. de C.V.",SADM-RP-06-2018-I,"$1,415,452.27",1-Oct-18,29-Nov-18,Sin Información,"$424,635.68",Sin convenio,$0.00,"$1,415,452.27","$1,089,121.63","$139,855.98",77%,98%,No Entregada,2-Apr-19,"La red de Agua Potable se encuentra totalmente terminada, la red de drenaje tiene un avance aproximado del 98 %, falta solamente el relleno y compactado de algunos tramos de zanja. (La planta de tratamiento no está en condiciones de operar.)"
4,2,11,Gral. Bravo,Construcción,"a) Introducción de red de drenaje sanitario con 521 metros de tubería de 0.20 m. (8"") Ø de policloruro de vinilo (P.V.C.) de pared sólida serie 20, NMX-E-215/1-SCFI-2003 vigente y 22 descargas domiciliarias.   b ) Introducción de red de drenaje sanitario con 291 metros de tubería de 0.20 m. (8"") Ø de policloruro de vinilo (P.V.C.) de pared sólida serie 20, NMX-E-215/1-SCFI-2003 vigente y 9 descargas domiciliarias.  c) Introducción de red de drenaje sanitario con 1,069 metros de tubería de 0.20 m. (8"") Ø de policloruro de vinilo (P.V.C.) de pared sólida serie 20, NMX-E-215/1-SCFI-2003 vigente y 37 descargas domiciliarias.","ADK Construcciones, S.A. de C.V.",SADM-APAUR-20-2018-I                                      ,"$4,746,162.61",20-Aug-18,27-Nov-18,8-Oct-18,"$1,423,848.48",Sin convenio,$0.00,"$4,746,162.61","$2,072,000.68","$1,144,527.40",44%,92%,No Entregada,10-Apr-19,"Obra a) se tiene 521 ml. de tubería instalada, 11 pozos de visita y 23 descargas domiciliarias, cuenta con 137.20 ml. de carpeta asfáltica, Obra b) se tiene trabajando 291 ml. de tubería instalada, 4 pozos de visita y 12 descargas y Obra c) se tiene 1043.50 ml. de tubería instalada, 16 pozos de visita (se prevé 3 más debido a aditivas), y 25 descargas domiciliarias instaladas."
4,2,12,Iturbide,Construcción,"a) Construcción de red de agua potable con 268 metros de tubería de PVC-C900 RD-25 de 4"" Ø y 13 tomas domiciliarias. b) Construcción de red de agua potable con 97 metros de tubería de PVC-C900 RD-25 de 4"" Ø y 15 tomas domiciliarias.  c) Introducción de 112 metros de red de drenaje sanitario en diámetro de 0.20 m (8""), en tubería de PVC pared sólida serie 20, incluye 11 descargas domiciliarias.  d) Introducción de 131 metros de red de drenaje sanitario en diámetro de 0.20 m (8""), en tubería de PVC pared sólida serie 20, incluye 8 descargas domiciliarias.","Cadena Arquitectos Y Asociados, S.A.  de C.V.",SADM-APARURAL-03-2018-I             ,"$2,306,681.02",9-Jul-18,26-Oct-18,26-Sep-18,"$692,004.31",Sin convenio,$0.00,"$2,306,681.02","$1,208,996.15","$470,436.39",52%,90%,No Entregada,3-Apr-19,"Avances: A) Red de Agua Potable, se tiene un avance físico del 100%  Parte de la instalación se efectuó en otra ubicación, no incluida en el contrato. B).Red de Agua Potable, se tiene un avance del 100%, C). Una parte de La Red de Drenaje sanitario, se ejecutó en  otra ubicación, no incluida en el contrato,  tiene un avance del 90 %, D). Se tiene un avance aproximado del 100%.          "
4,2,13,Juárez,Construcción,"Construcción de 1,688 mts. para la segunda línea de bombeo, de E.B. Villa Juárez a PTAR Dulces Nombres, con tubería de PAD EHWM RD-17, norma NMX-E-018-CNCP vigente (36""Ø) tramos varios. ","Huajuco Construcciones, S.A.  de C.V.",SADM-APAUR-03-2018-C                                ,"$23,381,792.43",18-May-18,3-Jan-19,17-May-18,"$7,014,537.73",25-May-18,$0.00,"$23,381,792.43","$23,319,372.37",$0.04,100%,95%,No Entregada,4-Apr-19,"No se encontró personal trabajando, faltan trabajos de  relleno en el cadenamiento 0+726 y en el cadenamiento 0+880 y pruebas de tubería."
4,2,14,Juárez,Construcción,"Construcción de 342 mts. de línea de bombeo de E.B. Villa Juárez a PTAR Dulces Nombres, con  tubería de PAD EHWM RD-17, norma NMX-E-018-CNCP vigente 36""Ø., incluyendo obras complementarias para la rehabilitación en estación de bombeo de aguas negras Juárez-Dulces Nombres: obra eléctrica, obra civil, rejilla pre-tratamiento. (2 pzas.); válvula de alivio de 12"" Ø,   (3 pzas.) ","Construcciones Y Servicios CYS, S.A.  de C.V.",SADM-APAUR-01-2018-C                       ,"$21,135,100.76",18-May-18,3-Jan-19,17-May-18,"$6,340,530.23",25-May-18,$0.00,"$21,135,100.76","$17,582,591.72","$1,499,237.28",83%,92%,No Entregada,4-Apr-19,"Se encontró personal trabajando en bombeo para junteo y pruebas para rectificaciones en uniones, se terminó con los trabajos de colado de registro, a la fecha no ha llegado el suministro de bomba a la obra."
4,2,15,Juárez,Construcción,"Construcción de 603 mts. de línea de bombeo de E.B. Villa Juárez a PTAR Dulces Nombres, con tubería de PAD EHWM RD-17, norma NMX-E-018-CNCP vigente 36""Ø. ","Petheriká Urbanizaciones Y Construcciones, S.A.  de C.V.",SADM-APAUR-02-2018-C                         ,"$9,477,283.17",18-May-18,3-Jan-19,17-May-18,"$2,843,184.95",25-May-18,$0.00,"$9,477,283.17","$9,447,126.45",$0.10,100%,99%,No Entregada,4-Apr-19,"No se encontró personal trabajando, actualmente falta la colocación de carpeta en unos 91 m2 aproximadamente, no se han realizado estos trabajos debido a trabajos que realiza gas natural dentro del tramo."
4,2,16,Juárez,Construcción,"Construcción de línea de bombeo de E.B. Villa Juárez a P.T.A.R. Dulces Nombres, con tubería de polietileno de alta densidad RD-17 de 914 mm (36"") Ø de cad. 4+105 al 4+348, longitud total  243 metros. ","HUAJUCO CONSTRUCCIONES, S.A. DE C.V.",SADM-APAUR-25-2018-C,"$1,997,832.13",14-Jan-19,29-Mar-19,En Trámite,Sin Información,Sin convenio,$0.00,"$1,997,832.13",$0.00,$0.00,0%,70%,No Entregada,4-Apr-19,"Se encontró personal trabajando en colocación de tee en área de registro de válvula de aire, se tiene excavación y plantilla del cad. 4+212 al 4+348 y falta rellenos en el cad. 4+105 al 4+125."
4,2,17,Juárez,Construcción,"Construcción de línea de bombeo de E.B. Villa Juárez a P.T.A.R. Dulces Nombres, con tubería de polietileno de alta densidad RD-17 de 914 mm (36"") Ø de cad. 0+940.00 al 1+152.00, longitud total  212 metros. ","PETHERIKA URBANIZACIONES Y CONSTRUCCIONES, S.A. DE C.V.",SADM-APAUR-23-2018-C,"$1,787,460.12",14-Jan-19,29-Mar-19,En Trámite,Sin Información,Sin convenio,$0.00,"$1,787,460.12",$0.00,$0.00,0%,80%,No Entregada,4-Apr-19,"Se encontró personal trabajando en bombeo de agua: Falta colocación de carpeta en cad. 1+030  al 1+075.6 y cad. 0+940 al 0+970 observando base contaminada debido a escurrimientos de agua, se tiene colocación de carpeta en cad. 0+970 al 1+030, falta relleno en el cad. 1+075.6 al 1+030"
