4,2,18,Monterrey,Construcción,"Introducción de red de agua potable de 250 mts. De tubería de policloruro de vinilo (PVC.) Con norma awwa-c900 de 4"" diam. En rd-25 y  6 tomas domiciliarias, construcción de 505 mts. De línea de conducción con tubería de acero al carbón de 3"" diam. Y equipamiento mecánico y eléctrico  de 2 estaciones de bombeo con 2 bombas para un caudal de 2 lps y 220 mts. De cdt cada una, extensión de línea eléctrica y construcción de tanque superficial de concreto con capacidad de 50 m.3","Kelvin Construcciones, S.A. de C.V.",SADM-APAUR-16-2018-C   ,"$10,084,912.58",4-Sep-18,13-Dec-18,3-Sep-18,"$3,025,473.77",12-Sep-18,$0.00,"$10,084,912.58","$7,208,533.35","$1,216,018.69",71%,92%,No Entregada,4-Apr-19,"Se observó que había gente trabajando en el Estación de Bombeo No. 3 (Cárcamo), terminaron de apuntalar la última parte del muro del Cárcamo, para recibir el concreto, llego la Bomba y 2 Trompos para vaciar el Muro del Cárcamo. Vaciaron el Firme de acceso a la Est. de Bombeo No. 2, están reforzando el piso de las bases de la tubería de 3"" diam."
4,2,19,Monterrey,Construcción,"Construcción de 07 macro circuitos para la modulación y regulación de presiones, la reducción de pérdidas por fugas y fatigas en las tuberías que forman parte del Plan Hídrico, incluyen: suministro e instalación de 7 válvulas moduladoras y reguladoras de presión de 6”, 8”, 10"" y 12” de diámetro para una presión de 150 lbs/pulg2., construcción de 7 cajas registro para alojar válvulas y piezas especiales para eficientar la operación de las redes de distribución primaria y secundaria. ","SOLUCIONES PARA EL CONTROL DE RECURSOS, S.A. DE C.V.",SADM-APAUR-22-2018-C,"$9,938,914.17",28-Dec-18,27-Mar-19,En Trámite,Sin Información,Sin convenio,$0.00,"$9,938,914.17",$0.00,$0.00,0%,19%,No Entregada,5-Apr-19,"Continúan trabajando en el Municipio de Guadalupe (3 Obras), y en el Municipio de Monterrey (1 Obra), ya tienen lista la excavación, les falta armar las piezas que van arriba del tubo existente, para poder vaciar la Losa, NOTA: no había gente trabajando, porque están armando las piezas que van arriba de la tubería existente.              "
4,2,20,Monterrey,Construcción,"Construcción de by-pass de tanque ""penal""  con 120 mts. de tubería de acero al carbón con calidad api-5lbde  48"" diam. X 1/2"" esp., no incluye el suministro de tubería de acero de 48"" diam.","Flotresa Construcciones, S.A. de C.V.",SADM-APAUR-12-2018-C   ,"$4,263,172.44",6-Aug-18,23-Nov-18,26-Sep-18,"$1,278,951.73",Sin convenio,$0.00,"$4,263,172.44","$1,688,787.48","$1,101,560.10",40%,88%,No Entregada,5-Apr-19,"En visita al lugar se observó que instalaron codos y tubería, están pintando codos, bridas y tee. El viernes 12 de Abril van a instalar tee, tubería, brida y válvula de un extremo de la tubería nueva, y continúan con la fabricación de codos para poder instalar la tubería restante.  Van a cortar el agua a varias colonias durante 6 horas."
4,2,21,Monterrey,Construcción,"Construcción de colector Huánuco-la chueca con 612 mts. de tubería de policloruro de vinilo de pared solida serie 20 con junta hermética de 12"" diam. Según norma nmx-e-215/1-scfi vigente.","Bufete Urbanístico, S.A. de C.V.",SADM-RP-04-2018-I   ,"$2,879,738.74",23-Jul-18,29-Dec-18,17-Aug-18,"$863,921.62",Sin convenio,$0.00,"$2,879,738.74","$863,921.62","$863,921.62",30%,84%,No Entregada,5-Apr-19,"En visita de Obra se observó que ya terminaron de instalar la tubería y están compactando el área excavada, ya terminaron de construir todos los Registros. Falta de colocarla carpeta asfáltica y entre hoy y mañana lo van a hacer."
4,2,22,Monterrey,Ampliación ,"Colector el Huánuco, 2a. etapa, suministro e instalación de tubería de policloruro de vinilo (PVC) serie 20 con junta hermética de 46 cm.  (18"") diam.","Movi Terra Construcciones, S.A. de C.V.",SADM-RP-01-2018-I   ,"$2,693,038.59",2-Apr-18,30-Jul-18,1-Jun-18,"$807,911.58",Sin convenio,$0.00,"$2,693,038.59","$2,415,870.80","$116,946.71",90%,96%,No Entregada,4-Apr-19,"Se observó que esta compactado el área excavada, falta instalar la Carpeta Asfáltica, falta retirar un poco de Tierra, pero el Contratista y su gente estaban ausentes porque la semana pasada estuvo lloviendo y se fueron a su tierra (Tampico) a descansar aprovechando el clima lluvioso, el residente ya les está hablando para que vengan y terminen."
4,2,23,Monterrey,Construcción,"Construcción de alimentador de agua potable de 800 m.l. con tubería de PVC RD-18  de 8"" de diámetro norma AWWA C-900 vigente 
","FOJA INGENIEROS CONSTRUCTORES, S.A.  DE C.V.",SADM-DEV-DER-01-2018-AD,"$2,493,451.26",1-Oct-18,28-Jan-19,26-Oct-18,"$748,035.38",Sin convenio,$0.00,"$2,493,451.26","$748,035.37","$748,035.37",30%,50%,No Entregada,5-Apr-19,"Se tiene instalado 456 metros lineales de tubería ya instalada, alrededor de 14 metros de Excavación y trazo de alrededor de 122.50 metros de pavimentos cortado con disco, la obra presento problemas de retraso, debido a que los habitantes de la zona no dejaban al contratista."
4,2,24,San Pedro,Construcción,"Construcción de línea de bombeo de Tanque ""San Agustín II"" con 627 metros de tubería de polietileno de alta densidad termofusionable de 12"" en RD-11. ","M T EXCAVA Y CONSTRUYE, S.A. DE C.V.",SADM-RP-10-2018-I,"$2,900,325.32",7-Jan-19,7-Mar-19,En Trámite,Sin Información,Sin convenio,$0.00,"$2,900,325.32",$0.00,$0.00,0%,35%,No Entregada,5-Apr-19,"Se puede apreciar la falta de señalización, siendo que en el catálogo de obra esta cotizado un monto de $64,092.43 antes de IVA para este concepto, se lleva hasta este momento 583 metros de trazo excavado, 287.50 metros de plantilla C.N.C. y suministro de alrededor de 420 metros de tubería de polietileno de alta densidad termofusionable de 12"" en RD·11."
4,2,25,Santa Catarina,Construcción,"Construcción de línea de alimentación de agua potable con 1,238 metros de tubería de policloruro de vinilo PVC AWWA-C900 hidráulico azul RD-25 de 6"" Ø, 49 metros de tubería de acero al carbón de 6"" Ø, 38 metros de tubería de acero al carbón de 6"" Ø instalados dentro de funda de 38 metros de tubería de acero al carbón de 10"" Ø (por el sistema de hincado). ","CONAMSA URBANIZADORA, S.A. DE C.V.",SADM-RP-09-2018-I,"$2,659,857.91",7-Jan-19,6-Apr-19,En Trámite,Sin Información,Sin convenio,$0.00,"$2,659,857.91",$0.00,$0.00,0%,48%,No Entregada,8-Apr-19,"La obra se encuentra en proceso de construcción, donde en el área de trabajo se puede apreciar la falta de señalización, además de que a la fecha de inspección, se cuenta con 630.60 metros de tubería instalada y medida al momento de la inspección, teniendo hasta el momento de la visita un 48% de Avance Físico."

